{
  "schemaVersion": "1.0.0",
  "demandDataVersion": "bts-db1c-6mo-jul2025-apr2026-v2",
  "status": "pass",
  "provenance": {
    "airportOdMatrix": {
      "filename": "data/reference/airport_od_matrix_consolidated_v2.csv",
      "sha256": "49c04922ee0cebb3fef8aad923e04bd11874587a263c9511358ddb833b860bc6"
    },
    "intergroupDemandId": "intergroup-demand-consolidated-v2",
    "planningRulesId": "caa-planning-rules-v2",
    "manifest": "config/demand_data/bts_db1c_6mo_v2.json",
    "manifestSchemaVersion": "1.0.0"
  },
  "matrix": {
    "title": "Coastal American Airways - Airport-to-Airport O&D Matrix (Consolidated)",
    "description": "Average daily O&D passengers, real BTS DB1C data, simple mean of 6 months: July 2025, April 2026, December 2025, February 2026, January 2026, November 2025. Secondary-airport rows use the dampened own/primary blend (see BLEND_WEIGHTS in process_chunk.py). Rows = origin, Columns = destination. Values are directional.",
    "airportCount": 105,
    "directionalCellCount": 11025,
    "directionalPassengersPerDay": 101247.1
  },
  "summary": {
    "checks": 2,
    "passed": 2,
    "failed": 0
  },
  "checks": [
    {
      "id": "active_city_coverage",
      "status": "pass",
      "message": "Airport O-D matrix covers all 105 active cities",
      "metrics": {
        "activeCities": 105,
        "matrixAirports": 105,
        "missing": [],
        "unknown": [],
        "inactiveRepresented": []
      }
    },
    {
      "id": "golden_hub_assignment_parity",
      "status": "pass",
      "message": "Computed hub assignments match all 100 non-hub cities",
      "metrics": {
        "compared": 100,
        "matched": 100,
        "differences": []
      }
    }
  ],
  "marketSizes": {
    "ABE": 277.3,
    "ACY": 260.6,
    "AGS": 140.7,
    "ALB": 819.7,
    "ATW": 248.3,
    "AUS": 2864.3,
    "AVL": 423.2,
    "AVP": 153.8,
    "BDL": 1507.1,
    "BGR": 167.4,
    "BHM": 644.0,
    "BLV": 1661.0,
    "BNA": 3443.3,
    "BTR": 194.9,
    "BTV": 281.8,
    "BUF": 988.0,
    "BWI": 3298.6,
    "CAE": 275.7,
    "CAK": 1477.7,
    "CHA": 262.9,
    "CHS": 1198.5,
    "CID": 264.9,
    "CLT": 3125.5,
    "CMH": 1562.6,
    "COU": 67.5,
    "CRP": 161.9,
    "CRW": 102.0,
    "DAB": 215.4,
    "DAL": 4503.2,
    "DAY": 255.4,
    "DLH": 62.0,
    "DSM": 528.5,
    "ECP": 429.3,
    "ELP": 689.7,
    "ERI": 47.2,
    "EYW": 457.3,
    "FAR": 199.9,
    "FLL": 5339.7,
    "FSD": 250.4,
    "FWA": 200.1,
    "GNV": 128.2,
    "GPT": 154.3,
    "GRR": 781.1,
    "GSO": 373.1,
    "GSP": 611.6,
    "HOU": 3011.9,
    "HPN": 542.7,
    "HRL": 221.9,
    "HSV": 330.6,
    "HVN": 509.5,
    "ICT": 310.0,
    "ILM": 402.8,
    "IND": 1759.7,
    "ISP": 477.5,
    "JAN": 260.0,
    "JAX": 1395.6,
    "LBB": 236.6,
    "LEX": 325.6,
    "LIT": 399.5,
    "MAF": 294.2,
    "MCI": 1838.0,
    "MCN": 0.0,
    "MDT": 428.5,
    "MEM": 860.8,
    "MFE": 202.7,
    "MHT": 422.3,
    "MKE": 1023.2,
    "MLB": 146.3,
    "MOB": 140.5,
    "MSN": 435.4,
    "MSY": 2280.7,
    "MYR": 748.9,
    "OKC": 731.1,
    "OMA": 796.7,
    "ORH": 83.8,
    "PGD": 2300.5,
    "PHF": 898.6,
    "PIA": 149.5,
    "PIE": 3828.1,
    "PIT": 1871.8,
    "PNS": 652.5,
    "PVD": 1140.7,
    "PWM": 518.0,
    "RDU": 2614.3,
    "RFD": 8173.5,
    "ROA": 170.0,
    "ROC": 578.8,
    "SAT": 1641.4,
    "SAV": 743.2,
    "SBN": 231.1,
    "SDF": 828.8,
    "SFB": 8218.2,
    "SGF": 252.5,
    "SHV": 148.7,
    "SRQ": 1309.6,
    "SWF": 75.1,
    "SYR": 627.6,
    "TLH": 156.0,
    "TOL": 27.6,
    "TRI": 103.5,
    "TTN": 107.3,
    "TUL": 538.1,
    "TYS": 672.0,
    "VPS": 488.2,
    "XNA": 465.3
  },
  "multiHubAssignments": {
    "groups": [
      {
        "group": "APP",
        "centroid": {
          "latitude": 36.456233,
          "longitude": -84.393156
        },
        "qualifiedHubs": [
          "DAY",
          "JAX"
        ],
        "rankings": [
          {
            "hub": "DAY",
            "rank": "primary",
            "servablePassengersPerDay": 12122.0,
            "distanceRatio": 0.0,
            "qualified": true
          },
          {
            "hub": "JAX",
            "rank": "secondary",
            "servablePassengersPerDay": 5762.0,
            "distanceRatio": 1.848234,
            "qualified": true
          },
          {
            "hub": "MCI",
            "rank": "tertiary",
            "servablePassengersPerDay": 3070.0,
            "distanceRatio": 2.499916,
            "qualified": false
          }
        ]
      },
      {
        "group": "CGI",
        "centroid": {
          "latitude": 34.365992,
          "longitude": -80.556775
        },
        "qualifiedHubs": [
          "JAX",
          "PHF",
          "DAY"
        ],
        "rankings": [
          {
            "hub": "JAX",
            "rank": "primary",
            "servablePassengersPerDay": 18365.0,
            "distanceRatio": 0.0,
            "qualified": true
          },
          {
            "hub": "PHF",
            "rank": "secondary",
            "servablePassengersPerDay": 14129.0,
            "distanceRatio": 1.079174,
            "qualified": true
          },
          {
            "hub": "DAY",
            "rank": "tertiary",
            "servablePassengersPerDay": 6004.0,
            "distanceRatio": 1.569171,
            "qualified": true
          },
          {
            "hub": "MCI",
            "rank": "quaternary",
            "servablePassengersPerDay": 4644.0,
            "distanceRatio": 3.094367,
            "qualified": false
          }
        ]
      },
      {
        "group": "FLP",
        "centroid": {
          "latitude": 27.622267,
          "longitude": -81.594611
        },
        "qualifiedHubs": [
          "JAX"
        ],
        "rankings": [
          {
            "hub": "JAX",
            "rank": "primary",
            "servablePassengersPerDay": 40709.0,
            "distanceRatio": 0.0,
            "qualified": true
          },
          {
            "hub": "DAY",
            "rank": "secondary",
            "servablePassengersPerDay": 17324.0,
            "distanceRatio": 4.340816,
            "qualified": false
          }
        ]
      },
      {
        "group": "GCP",
        "centroid": {
          "latitude": 30.92116,
          "longitude": -87.94091
        },
        "qualifiedHubs": [
          "JAX",
          "MCI"
        ],
        "rankings": [
          {
            "hub": "JAX",
            "rank": "primary",
            "servablePassengersPerDay": 10038.0,
            "distanceRatio": 0.0,
            "qualified": true
          },
          {
            "hub": "MCI",
            "rank": "secondary",
            "servablePassengersPerDay": 3245.0,
            "distanceRatio": 1.861038,
            "qualified": true
          },
          {
            "hub": "DAY",
            "rank": "tertiary",
            "servablePassengersPerDay": 2895.0,
            "distanceRatio": 1.757407,
            "qualified": false
          }
        ]
      },
      {
        "group": "GLC",
        "centroid": {
          "latitude": 42.228138,
          "longitude": -87.2726
        },
        "qualifiedHubs": [
          "DAY"
        ],
        "rankings": [
          {
            "hub": "DAY",
            "rank": "primary",
            "servablePassengersPerDay": 23781.0,
            "distanceRatio": 0.0,
            "qualified": true
          },
          {
            "hub": "JAX",
            "rank": "secondary",
            "servablePassengersPerDay": 12745.0,
            "distanceRatio": 3.838318,
            "qualified": false
          }
        ]
      },
      {
        "group": "LEC",
        "centroid": {
          "latitude": 41.5904,
          "longitude": -80.707529
        },
        "qualifiedHubs": [
          "DAY",
          "SYR"
        ],
        "rankings": [
          {
            "hub": "DAY",
            "rank": "primary",
            "servablePassengersPerDay": 11913.0,
            "distanceRatio": 0.0,
            "qualified": true
          },
          {
            "hub": "SYR",
            "rank": "secondary",
            "servablePassengersPerDay": 10641.0,
            "distanceRatio": 1.182128,
            "qualified": true
          },
          {
            "hub": "JAX",
            "rank": "tertiary",
            "servablePassengersPerDay": 7716.0,
            "distanceRatio": 3.530953,
            "qualified": false
          }
        ]
      },
      {
        "group": "MAC",
        "centroid": {
          "latitude": 40.18235,
          "longitude": -75.66435
        },
        "qualifiedHubs": [
          "PHF",
          "SYR"
        ],
        "rankings": [
          {
            "hub": "PHF",
            "rank": "primary",
            "servablePassengersPerDay": 8018.0,
            "distanceRatio": 0.0,
            "qualified": true
          },
          {
            "hub": "SYR",
            "rank": "secondary",
            "servablePassengersPerDay": 7607.0,
            "distanceRatio": 0.945199,
            "qualified": true
          },
          {
            "hub": "JAX",
            "rank": "tertiary",
            "servablePassengersPerDay": 3920.0,
            "distanceRatio": 3.481453,
            "qualified": false
          }
        ]
      },
      {
        "group": "NEC",
        "centroid": {
          "latitude": 42.430517,
          "longitude": -72.276342
        },
        "qualifiedHubs": [
          "SYR"
        ],
        "rankings": [
          {
            "hub": "SYR",
            "rank": "primary",
            "servablePassengersPerDay": 12427.0,
            "distanceRatio": 0.0,
            "qualified": true
          },
          {
            "hub": "JAX",
            "rank": "secondary",
            "servablePassengersPerDay": 8764.0,
            "distanceRatio": 4.879343,
            "qualified": false
          }
        ]
      },
      {